[
  {"id": 1, "line_count": 6, "frequencies": ["shadow", "gift", "siddhi"], "name": null, "codon": null, "amino_acid": null, "i_ching_number": 1, "human_design_gate": 1, "programming_partner_id": null, "codon_ring_id": null},
  {"id": 2, "line_count": 6, "frequencies": ["shadow", "gift", "siddhi"], "name": null, "codon": null, "amino_acid": null, "i_ching_number": 2, "human_design_gate": 2, "programming_partner_id": null, "codon_ring_id": null},
  {"id": 3, "line_count": 6, "frequencies": ["shadow", "gift", "siddhi"], "name": null, "codon": null, "amino_acid": null, "i_ching_number": 3, "human_design_gate": 3, "programming_partner_id": null, "codon_ring_id": null},
  {"id": 4, "line_count": 6, "frequencies": ["shadow", "gift", "siddhi"], "name": null, "codon": null, "amino_acid": null, "i_ching_number": 4, "human_design_gate": 4, "programming_partner_id": null, "codon_ring_id": null},
  {"id": 5, "line_count": 6, "frequencies": ["shadow", "gift", "siddhi"], "name": null, "codon": null, "amino_acid": null, "i_ching_number": 5, "human_design_gate": 5, "programming_partner_id": null, "codon_ring_id": null},
  {"id": 6, "line_count": 6, "frequencies": ["shadow", "gift", "siddhi"], "name": null, "codon": null, "amino_acid": null, "i_ching_number": 6, "human_design_gate": 6, "programming_partner_id": null, "codon_ring_id": null},
  {"id": 7, "line_count": 6, "frequencies": ["shadow", "gift", "siddhi"], "name": null, "codon": null, "amino_acid": null, "i_ching_number": 7, "human_design_gate": 7, "programming_partner_id": null, "codon_ring_id": null},
  {"id": 8, "line_count": 6, "frequencies": ["shadow", "gift", "siddhi"], "name": null, "codon": null, "amino_acid": null, "i_ching_number": 8, "human_design_gate": 8, "programming_partner_id": null, "codon_ring_id": null},
  {"id": 9, "line_count": 6, "frequencies": ["shadow", "gift", "siddhi"], "name": null, "codon": null, "amino_acid": null, "i_ching_number": 9, "human_design_gate": 9, "programming_partner_id": null, "codon_ring_id": null},
  {"id": 10, "line_count": 6, "frequencies": ["shadow", "gift", "siddhi"], "name": null, "codon": null, "amino_acid": null, "i_ching_number": 10, "human_design_gate": 10, "programming_partner_id": null, "codon_ring_id": null},
  {"id": 11, "line_count": 6, "frequencies": ["shadow", "gift", "siddhi"], "name": null, "codon": null, "amino_acid": null, "i_ching_number": 11, "human_design_gate": 11, "programming_partner_id": null, "codon_ring_id": null},
  {"id": 12, "line_count": 6, "frequencies": ["shadow", "gift", "siddhi"], "name": null, "codon": null, "amino_acid": null, "i_ching_number": 12, "human_design_gate": 12, "programming_partner_id": null, "codon_ring_id": null},
  {"id": 13, "line_count": 6, "frequencies": ["shadow", "gift", "siddhi"], "name": null, "codon": null, "amino_acid": null, "i_ching_number": 13, "human_design_gate": 13, "programming_partner_id": null, "codon_ring_id": null},
  {"id": 14, "line_count": 6, "frequencies": ["shadow", "gift", "siddhi"], "name": null, "codon": null, "amino_acid": null, "i_ching_number": 14, "human_design_gate": 14, "programming_partner_id": null, "codon_ring_id": null},
  {"id": 15, "line_count": 6, "frequencies": ["shadow", "gift", "siddhi"], "name": null, "codon": null, "amino_acid": null, "i_ching_number": 15, "human_design_gate": 15, "programming_partner_id": null, "codon_ring_id": null},
  {"id": 16, "line_count": 6, "frequencies": ["shadow", "gift", "siddhi"], "name": null, "codon": null, "amino_acid": null, "i_ching_number": 16, "human_design_gate": 16, "programming_partner_id": null, "codon_ring_id": null},
  {"id": 17, "line_count": 6, "frequencies": ["shadow", "gift", "siddhi"], "name": null, "codon": null, "amino_acid": null, "i_ching_number": 17, "human_design_gate": 17, "programming_partner_id": null, "codon_ring_id": null},
  {"id": 18, "line_count": 6, "frequencies": ["shadow", "gift", "siddhi"], "name": null, "codon": null, "amino_acid": null, "i_ching_number": 18, "human_design_gate": 18, "programming_partner_id": null, "codon_ring_id": null},
  {"id": 19, "line_count": 6, "frequencies": ["shadow", "gift", "siddhi"], "name": null, "codon": null, "amino_acid": null, "i_ching_number": 19, "human_design_gate": 19, "programming_partner_id": null, "codon_ring_id": null},
  {"id": 20, "line_count": 6, "frequencies": ["shadow", "gift", "siddhi"], "name": null, "codon": null, "amino_acid": null, "i_ching_number": 20, "human_design_gate": 20, "programming_partner_id": null, "codon_ring_id": null},
  {"id": 21, "line_count": 6, "frequencies": ["shadow", "gift", "siddhi"], "name": null, "codon": null, "amino_acid": null, "i_ching_number": 21, "human_design_gate": 21, "programming_partner_id": null, "codon_ring_id": null},
  {"id": 22, "line_count": 6, "frequencies": ["shadow", "gift", "siddhi"], "name": null, "codon": null, "amino_acid": null, "i_ching_number": 22, "human_design_gate": 22, "programming_partner_id": null, "codon_ring_id": null},
  {"id": 23, "line_count": 6, "frequencies": ["shadow", "gift", "siddhi"], "name": null, "codon": null, "amino_acid": null, "i_ching_number": 23, "human_design_gate": 23, "programming_partner_id": null, "codon_ring_id": null},
  {"id": 24, "line_count": 6, "frequencies": ["shadow", "gift", "siddhi"], "name": null, "codon": null, "amino_acid": null, "i_ching_number": 24, "human_design_gate": 24, "programming_partner_id": null, "codon_ring_id": null},
  {"id": 25, "line_count": 6, "frequencies": ["shadow", "gift", "siddhi"], "name": null, "codon": null, "amino_acid": null, "i_ching_number": 25, "human_design_gate": 25, "programming_partner_id": null, "codon_ring_id": null},
  {"id": 26, "line_count": 6, "frequencies": ["shadow", "gift", "siddhi"], "name": null, "codon": null, "amino_acid": null, "i_ching_number": 26, "human_design_gate": 26, "programming_partner_id": null, "codon_ring_id": null},
  {"id": 27, "line_count": 6, "frequencies": ["shadow", "gift", "siddhi"], "name": null, "codon": null, "amino_acid": null, "i_ching_number": 27, "human_design_gate": 27, "programming_partner_id": null, "codon_ring_id": null},
  {"id": 28, "line_count": 6, "frequencies": ["shadow", "gift", "siddhi"], "name": null, "codon": null, "amino_acid": null, "i_ching_number": 28, "human_design_gate": 28, "programming_partner_id": null, "codon_ring_id": null},
  {"id": 29, "line_count": 6, "frequencies": ["shadow", "gift", "siddhi"], "name": null, "codon": null, "amino_acid": null, "i_ching_number": 29, "human_design_gate": 29, "programming_partner_id": null, "codon_ring_id": null},
  {"id": 30, "line_count": 6, "frequencies": ["shadow", "gift", "siddhi"], "name": null, "codon": null, "amino_acid": null, "i_ching_number": 30, "human_design_gate": 30, "programming_partner_id": null, "codon_ring_id": null},
  {"id": 31, "line_count": 6, "frequencies": ["shadow", "gift", "siddhi"], "name": null, "codon": null, "amino_acid": null, "i_ching_number": 31, "human_design_gate": 31, "programming_partner_id": null, "codon_ring_id": null},
  {"id": 32, "line_count": 6, "frequencies": ["shadow", "gift", "siddhi"], "name": null, "codon": null, "amino_acid": null, "i_ching_number": 32, "human_design_gate": 32, "programming_partner_id": null, "codon_ring_id": null},
  {"id": 33, "line_count": 6, "frequencies": ["shadow", "gift", "siddhi"], "name": null, "codon": null, "amino_acid": null, "i_ching_number": 33, "human_design_gate": 33, "programming_partner_id": null, "codon_ring_id": null},
  {"id": 34, "line_count": 6, "frequencies": ["shadow", "gift", "siddhi"], "name": null, "codon": null, "amino_acid": null, "i_ching_number": 34, "human_design_gate": 34, "programming_partner_id": null, "codon_ring_id": null},
  {"id": 35, "line_count": 6, "frequencies": ["shadow", "gift", "siddhi"], "name": null, "codon": null, "amino_acid": null, "i_ching_number": 35, "human_design_gate": 35, "programming_partner_id": null, "codon_ring_id": null},
  {"id": 36, "line_count": 6, "frequencies": ["shadow", "gift", "siddhi"], "name": null, "codon": null, "amino_acid": null, "i_ching_number": 36, "human_design_gate": 36, "programming_partner_id": null, "codon_ring_id": null},
  {"id": 37, "line_count": 6, "frequencies": ["shadow", "gift", "siddhi"], "name": null, "codon": null, "amino_acid": null, "i_ching_number": 37, "human_design_gate": 37, "programming_partner_id": null, "codon_ring_id": null},
  {"id": 38, "line_count": 6, "frequencies": ["shadow", "gift", "siddhi"], "name": null, "codon": null, "amino_acid": null, "i_ching_number": 38, "human_design_gate": 38, "programming_partner_id": null, "codon_ring_id": null},
  {"id": 39, "line_count": 6, "frequencies": ["shadow", "gift", "siddhi"], "name": null, "codon": null, "amino_acid": null, "i_ching_number": 39, "human_design_gate": 39, "programming_partner_id": null, "codon_ring_id": null},
  {"id": 40, "line_count": 6, "frequencies": ["shadow", "gift", "siddhi"], "name": null, "codon": null, "amino_acid": null, "i_ching_number": 40, "human_design_gate": 40, "programming_partner_id": null, "codon_ring_id": null},
  {"id": 41, "line_count": 6, "frequencies": ["shadow", "gift", "siddhi"], "name": null, "codon": null, "amino_acid": null, "i_ching_number": 41, "human_design_gate": 41, "programming_partner_id": null, "codon_ring_id": null},
  {"id": 42, "line_count": 6, "frequencies": ["shadow", "gift", "siddhi"], "name": null, "codon": null, "amino_acid": null, "i_ching_number": 42, "human_design_gate": 42, "programming_partner_id": null, "codon_ring_id": null},
  {"id": 43, "line_count": 6, "frequencies": ["shadow", "gift", "siddhi"], "name": null, "codon": null, "amino_acid": null, "i_ching_number": 43, "human_design_gate": 43, "programming_partner_id": null, "codon_ring_id": null},
  {"id": 44, "line_count": 6, "frequencies": ["shadow", "gift", "siddhi"], "name": null, "codon": null, "amino_acid": null, "i_ching_number": 44, "human_design_gate": 44, "programming_partner_id": null, "codon_ring_id": null},